{
  "mission_id": "MIS-REFLEX-AGENT-OS-V3",
  "owner_runtime": "antigravity",
  "owner_role": "R1",
  "branch": "antigravity/reflex-agent-os-v3",
  "scope": "Multiagent architecture consolidation, docs/agent-system/, canonical R1-R9 registry, shared skills, hooks and verification",
  "started_at": "2026-09-19T19:30:00-03:00",
  "status": "HANDOFF_PENDING"
}
